### ISSUE TITLE
`pyiceberg.load_table` on lakekeeper is much slower than the toy rest implemention by iceberg

### ISSUE THREAD

**Issue by TennyZhuang** [lakekeeper/lakekeeper#782]
https://github.com/databricks/iceberg-rest-image is a toy rest implementation.

However, in the similar context with the almost same table (only with register_table), lakekeeper is much slower than that one.

<img width="1215" alt="Image" src="https://github.com/user-attachments/assets/b795eab8-8693-4816-a8e9-d4b388890a77" />

In the image
* `catalog1` is a rest catalog from that repo, and the rest server is backed by a `SqlCatalog` implementation to a postgresql15 server.
* `catalog2` is a rest catalog backed by lakekeeper. I bootstraped lakekeeper using the docker-compose.yaml under `docker-compose` folder.

The catalog2 initialization:

```python
catalog2 = load_catalog(
    "db3",
    **{
        "type": "rest",
        "uri": "http://localhost:8181/catalog/",
        "warehouse": "db3",
        "s3.endpoint": db3.MINIO_ADDRESS,
        "py-io-impl": "pyiceberg.io.pyarrow.PyArrowFileIO",
        "s3.access-key-id": db3.AK,
        "s3.secret-access-key": db3.SK,
        "s3.connect-timeout": 60.0,
    }
)
```

pyiceberg version: 0.7.1
Python version: 3.8.3

All deployments are on the same machine.

I know that there is not enough information to reproduce the problem. I just want to know if this is a known issue first. If it is, I can wait for a new version with optimization. If not, I can then provide more information to help debug the problem.

**Comment by twuebi** [comment]
Hi, I just tested our pyiceberg example and it took 5-9 microseconds to load a table:

<img width="484" alt="Image" src="https://github.com/user-attachments/assets/1a51aac9-2963-4dd9-b8ba-66e702265e42" />

Back in December I also did some [load-testing](https://github.com/lakekeeper/lakekeeper/issues/623#issuecomment-2525085301 ) for specifically GET + POST table which is much more work than a simple load table should be.

Could you try profiling? Did you run the cell multiple times? Did the logs have something?

**Comment by TennyZhuang** [comment]
I ran the cell multiple times, including continuously calling or restarting the Python kernel. And there is nothing logged for these requests.

Do you have some good profiling methods? E.g. detailed tracing. I will try to capture the network packet first.

**Comment by TennyZhuang** [comment]
I use tcpdump to capture the network.

```
01:45:26.039314 IP 172.18.0.1.45038 > f15b99ef190b.8181: Flags [P.], seq 338:676, ack 3048, win 41, options [nop,nop,TS val 735053216 ecr 292077095], length 338
01:45:26.039335 IP f15b99ef190b.8181 > 172.18.0.1.45038: Flags [.], ack 676, win 42, options [nop,nop,TS val 292089310 ecr 735053216], length 0
01:45:26.039660 IP f15b99ef190b.42718 > docker-compose-db-1.docker-compose_iceberg_net.5432: Flags [P.], seq 424:435, ack 26737, win 20347, options [nop,nop,TS val 834624140 ecr 2113874598], length 11
01:45:26.039857 IP docker-compose-db-1.docker-compose_iceberg_net.5432 > f15b99ef190b.42718: Flags [P.], seq 26737:26754, ack 435, win 1923, options [nop,nop,TS val 2113889750 ecr 834624140], length 17
01:45:26.039877 IP f15b99ef190b.42718 > docker-compose-db-1.docker-compose_iceberg_net.5432: Flags [.], ack 26754, win 20347, options [nop,nop,TS val 834624140 ecr 2113889750], length 0
01:45:26.039928 IP f15b99ef190b.42718 > docker-compose-db-1.docker-compose_iceberg_net.5432: Flags [P.], seq 435:466, ack 26754, win 20347, options [nop,nop,TS val 834624141 ecr 2113889750], length 31
01:45:26.039989 IP docker-compose-db-1.docker-compose_iceberg_net.5432 > f15b99ef190b.42718: Flags [P.], seq 26754:26769, ack 466, win 1923, options [nop,nop,TS val 2113889751 ecr 834624141], length 15
01:45:26.040049 IP f15b99ef190b.42718 > docker-compose-db-1.docker-compose_iceberg_net.5432: Flags [P.], seq 466:611, ack 26769, win 20347, options [nop,nop,TS val 834624141 ecr 2113889751], length 145
01:45:26.040478 IP docker-compose-db-1.docker-compose_iceberg_net.5432 > f15b99ef190b.42718: Flags [P.], seq 26769:26864, ack 611, win 1923, options [nop,nop,TS val 2113889751 ecr 834624141], length 95
01:45:26.040543 IP f15b99ef190b.42718 > docker-compose-db-1.docker-compose_iceberg_net.5432: Flags [P.], seq 611:727, ack 26864, win 20347, options [nop,nop,TS val 834624141 ecr 2113889751], length 116
01:45:26.080758 IP docker-compose-db-1.docker-compose_iceberg_net.5432 > f15b99ef190b.42718: Flags [.], ack 727, win 1923, options [nop,nop,TS val 2113889791 ecr 834624141], length 0
01:45:31.439921 IP f15b99ef190b.43070 > docker-compose-db-1.docker-compose_iceberg_net.5432: Flags [P.], seq 366:468, ack 199, win 3303, options [nop,nop,TS val 834629540 ecr 2113885099], length 102
01:45:31.440272 IP docker-compose-db-1.docker-compose_iceberg_net.5432 > f15b99ef190b.43070: Flags [P.], seq 199:229, ack 468, win 27763, options [nop,nop,TS val 2113895151 ecr 834629540], length 30
01:45:31.440282 IP f15b99ef190b.43070 > docker-compose-db-1.docker-compose_iceberg_net.5432: Flags [.], ack 229, win 3303, options [nop,nop,TS val 834629541 ecr 2113895151], length 0
01:45:31.440343 IP f15b99ef190b.43070 > docker-compose-db-1.docker-compose_iceberg_net.5432: Flags [P.], seq 468:473, ack 229, win 3303, options [nop,nop,TS val 834629541 ecr 2113895151], length 5
01:45:31.440363 IP docker-compose-db-1.docker-compose_iceberg_net.5432 > f15b99ef190b.43070: Flags [P.], seq 229:235, ack 473, win 27763, options [nop,nop,TS val 2113895151 ecr 834629541], length 6
01:45:31.480752 IP f15b99ef190b.43070 > docker-compose-db-1.docker-compose_iceberg_net.5432: Flags [.], ack 235, win 3303, options [nop,nop,TS val 834629581 ecr 2113895151], length 0
01:45:31.839077 IP f15b99ef190b.42706 > docker-compose-db-1.docker-compose_iceberg_net.5432: Flags [P.], seq 418:515, ack 193, win 4162, options [nop,nop,TS val 834629940 ecr 2113885150], length 97
01:45:31.839328 IP docker-compose-db-1.docker-compose_iceberg_net.5432 > f15b99ef190b.42706: Flags [P.], seq 193:223, ack 515, win 27763, options [nop,nop,TS val 2113895550 ecr 834629940], length 30
01:45:31.839339 IP f15b99ef190b.42706 > docker-compose-db-1.docker-compose_iceberg_net.5432: Flags [.], ack 223, win 4162, options [nop,nop,TS val 834629940 ecr 2113895550], length 0
01:45:31.839390 IP f15b99ef190b.42706 > docker-compose-db-1.docker-compose_iceberg_net.5432: Flags [P.], seq 515:520, ack 223, win 4162, options [nop,nop,TS val 834629940 ecr 2113895550], length 5
01:45:31.839407 IP docker-compose-db-1.docker-compose_iceberg_net.5432 > f15b99ef190b.42706: Flags [P.], seq 223:229, ack 520, win 27763, options [nop,nop,TS val 2113895550 ecr 834629940], length 6
01:45:31.879739 IP f15b99ef190b.42706 > docker-compose-db-1.docker-compose_iceberg_net.5432: Flags [.], ack 229, win 4162, options [nop,nop,TS val 834629980 ecr 2113895550], length 0
01:45:31.888715 IP f15b99ef190b.42716 > docker-compose-db-1.docker-compose_iceberg_net.5432: Flags [P.], seq 156:203, ack 127, win 2266, options [nop,nop,TS val 834629989 ecr 2113885099], length 47
01:45:31.888724 IP f15b99ef190b.42704 > docker-compose-db-1.docker-compose_iceberg_net.5432: Flags [P.], seq 251:298, ack 315, win 2085, options [nop,nop,TS val 834629989 ecr 2113885099], length 47
01:45:31.888861 IP docker-compose-db-1.docker-compose_iceberg_net.5432 > f15b99ef190b.42704: Flags [P.], seq 315:351, ack 298, win 1904, options [nop,nop,TS val 2113895599 ecr 834629989], length 36
01:45:31.888869 IP f15b99ef190b.42704 > docker-compose-db-1.docker-compose_iceberg_net.5432: Flags [.], ack 351, win 2085, options [nop,nop,TS val 834629989 ecr 2113895599], length 0
01:45:31.888884 IP docker-compose-db-1.docker-compose_iceberg_net.5432 > f15b99ef190b.42716: Flags [P.], seq 127:163, ack 203, win 41, options [nop,nop,TS val 2113895599 ecr 834629989], length 36
01:45:31.888904 IP f15b99ef190b.42716 > docker-compose-db-1.docker-compose_iceberg_net.5432: Flags [.], ack 163, win 2266, options [nop,nop,TS val 834629989 ecr 2113895599], length 0
01:45:31.888923 IP f15b99ef190b.42726 > docker-compose-db-1.docker-compose_iceberg_net.5432: Flags [P.], seq 466:513, ack 235, win 2093, options [nop,nop,TS val 834629990 ecr 2113885536], length 47
01:45:31.888943 IP f15b99ef190b.42704 > docker-compose-db-1.docker-compose_iceberg_net.5432: Flags [P.], seq 298:303, ack 351, win 2085, options [nop,nop,TS val 834629990 ecr 2113895599], length 5
01:45:31.888958 IP docker-compose-db-1.docker-compose_iceberg_net.5432 > f15b99ef190b.42704: Flags [P.], seq 351:357, ack 303, win 1904, options [nop,nop,TS val 2113895600 ecr 834629990], length 6
01:45:31.888986 IP f15b99ef190b.43070 > docker-compose-db-1.docker-compose_iceberg_net.5432: Flags [P.], seq 473:520, ack 235, win 3303, options [nop,nop,TS val 834629990 ecr 2113895151], length 47
01:45:31.889000 IP f15b99ef190b.42716 > docker-compose-db-1.docker-compose_iceberg_net.5432: Flags [P.], seq 203:208, ack 163, win 2266, options [nop,nop,TS val 834629990 ecr 2113895599], length 5
01:45:31.889009 IP docker-compose-db-1.docker-compose_iceberg_net.5432 > f15b99ef190b.42726: Flags [P.], seq 235:271, ack 513, win 27763, options [nop,nop,TS val 2113895600 ecr 834629990], length 36
01:45:31.889017 IP f15b99ef190b.42726 > docker-compose-db-1.docker-compose_iceberg_net.5432: Flags [.], ack 271, win 2093, options [nop,nop,TS val 834629990 ecr 2113895600], length 0
01:45:31.889023 IP docker-compose-db-1.docker-compose_iceberg_net.5432 > f15b99ef190b.42716: Flags [P.], seq 163:169, ack 208, win 41, options [nop,nop,TS val 2113895600 ecr 834629990], length 6
01:45:31.889066 IP docker-compose-db-1.docker-compose_iceberg_net.5432 > f15b99ef190b.43070: Flags [P.], seq 235:271, ack 520, win 27763, options [nop,nop,TS val 2113895600 ecr 834629990], length 36
01:45:31.889073 IP f15b99ef190b.42726 > docker-compose-db-1.docker-compose_iceberg_net.5432: Flags [P.], seq 513:518, ack 271, win 2093, options [nop,nop,TS val 834629990 ecr 2113895600], length 5
01:45:31.889074 IP f15b99ef190b.43070 > docker-compose-db-1.docker-compose_iceberg_net.5432: Flags [.], ack 271, win 3303, options [nop,nop,TS val 834629990 ecr 2113895600], length 0
01:45:31.889089 IP docker-compose-db-1.docker-compose_iceberg_net.5432 > f15b99ef190b.42726: Flags [P.], seq 271:277, ack 518, win 27763, options [nop,nop,TS val 2113895600 ecr 834629990], length 6
01:45:31.889110 IP f15b99ef190b.43070 > docker-compose-db-1.docker-compose_iceberg_net.5432: Flags [P.], seq 520:525, ack 271, win 3303, options [nop,nop,TS val 834629990 ecr 2113895600], length 5
01:45:31.889127 IP docker-compose-db-1.docker-compose_iceberg_net.5432 > f15b99ef190b.43070: Flags [P.], seq 271:277, ack 525, win 27763, options [nop,nop,TS val 2113895600 ecr 834629990], length 6
01:45:31.929746 IP f15b99ef190b.42716 > docker-compose-db-1.docker-compose_iceberg_net.5432: Flags [.], ack 169, win 2266, options [nop,nop,TS val 834630030 ecr 2113895600], length 0
01:45:31.929751 IP f15b99ef190b.43070 > docker-compose-db-1.docker-compose_iceberg_net.5432: Flags [.], ack 277, win 3303, options [nop,nop,TS val 834630030 ecr 2113895600], length 0
01:45:31.929751 IP f15b99ef190b.42704 > docker-compose-db-1.docker-compose_iceberg_net.5432: Flags [.], ack 357, win 2085, options [nop,nop,TS val 834630030 ecr 2113895600], length 0
01:45:31.929751 IP f15b99ef190b.42726 > docker-compose-db-1.docker-compose_iceberg_net.5432: Flags [.], ack 277, win 2093, options [nop,nop,TS val 834630030 ecr 2113895600], length 0
01:45:35.556332 IP docker-compose-db-1.docker-compose_iceberg_net.5432 > f15b99ef190b.42718: Flags [P.], seq 26864:29760, ack 727, win 1923, options [nop,nop,TS val 2113899267 ecr 834624141], length 2896
01:45:35.556353 IP f15b99ef190b.42718 > docker-compose-db-1.docker-compose_iceberg_net.5432: Flags [.], ack 29760, win 20347, options [nop,nop,TS val 834633657 ecr 2113899267], length 0
01:45:35.556365 IP docker-compose-db-1.docker-compose_iceberg_net.5432 > f15b99ef190b.42718: Flags [P.], seq 29760:32656, ack 727, win 1923, options [nop,nop,TS val 2113899267 ecr 834624141], length 2896
01:45:35.556372 IP docker-compose-db-1.docker-compose_iceberg_net.5432 > f15b99ef190b.42718: Flags [P.], seq 32656:35056, ack 727, win 1923, options [nop,nop,TS val 2113899267 ecr 834624141], length 2400
01:45:35.556384 IP docker-compose-db-1.docker-compose_iceberg_net.5432 > f15b99ef190b.42718: Flags [P.], seq 35056:37952, ack 727, win 1923, options [nop,nop,TS val 2113899267 ecr 834633657], length 2896
01:45:35.556392 IP docker-compose-db-1.docker-compose_iceberg_net.5432 > f15b99ef190b.42718: Flags [P.], seq 37952:40848, ack 727, win 1923, options [nop,nop,TS val 2113899267 ecr 834633657], length 2896
01:45:35.556396 IP docker-compose-db-1.docker-compose_iceberg_net.5432 > f15b99ef190b.42718: Flags [P.], seq 40848:43248, ack 727, win 1923, options [nop,nop,TS val 2113899267 ecr 834633657], length 2400
01:45:35.556404 IP docker-compose-db-1.docker-compose_iceberg_net.5432 > f15b99ef190b.42718: Flags [P.], seq 43248:46144, ack 727, win 1923, options [nop,nop,TS val 2113899267 ecr 834633657], length 2896
01:45:35.556547 IP f15b99ef190b.42718 > docker-compose-db-1.docker-compose_iceberg_net.5432: Flags [.], ack 46144, win 20347, options [nop,nop,TS val 834633657 ecr 2113899267], length 0
01:45:35.556590 IP docker-compose-db-1.docker-compose_iceberg_net.5432 > f15b99ef190b.42718: Flags [P.], seq 46144:51440, ack 727, win 1923, options [nop,nop,TS val 2113899267 ecr 834633657], length 5296
01:45:35.556607 IP f15b99ef190b.42718 > docker-compose-db-1.docker-compose_iceberg_net.5432: Flags [.], ack 51440, win 20347, options [nop,nop,TS val 834633657 ecr 2113899267], length 0
01:45:35.606694 IP docker-compose-db-1.docker-compose_iceberg_net.5432 > f15b99ef190b.42718: Flags [P.], seq 51440:53365, ack 727, win 1923, options [nop,nop,TS val 2113899317 ecr 834633657], length 1925
01:45:35.606712 IP f15b99ef190b.42718 > docker-compose-db-1.docker-compose_iceberg_net.5432: Flags [.], ack 53365, win 20347, options [nop,nop,TS val 834633707 ecr 2113899317], length 0
01:45:35.607677 IP f15b99ef190b.42718 > docker-compose-db-1.docker-compose_iceberg_net.5432: Flags [P.], seq 727:739, ack 53365, win 20347, options [nop,nop,TS val 834633708 ecr 2113899317], length 12
01:45:35.607712 IP docker-compose-db-1.docker-compose_iceberg_net.5432 > f15b99ef190b.42718: Flags [.], ack 739, win 1923, options [nop,nop,TS val 2113899318 ecr 834633708], length 0
01:45:35.607812 IP docker-compose-db-1.docker-compose_iceberg_net.5432 > f15b99ef190b.42718: Flags [P.], seq 53365:53383, ack 739, win 1923, options [nop,nop,TS val 2113899318 ecr 834633708], length 18
01:45:35.607887 IP f15b99ef190b.42704 > docker-compose-db-1.docker-compose_iceberg_net.5432: Flags [P.], seq 303:393, ack 357, win 2085, options [nop,nop,TS val 834633708 ecr 2113895600], length 90
01:45:35.607913 IP f15b99ef190b.42718 > docker-compose-db-1.docker-compose_iceberg_net.5432: Flags [P.], seq 739:744, ack 53383, win 20347, options [nop,nop,TS val 834633709 ecr 2113899318], length 5
01:45:35.607934 IP docker-compose-db-1.docker-compose_iceberg_net.5432 > f15b99ef190b.42718: Flags [P.], seq 53383:53389, ack 744, win 1923, options [nop,nop,TS val 2113899319 ecr 834633709], length 6
01:45:35.608388 IP docker-compose-db-1.docker-compose_iceberg_net.5432 > f15b99ef190b.42704: Flags [P.], seq 357:539, ack 393, win 1904, options [nop,nop,TS val 2113899319 ecr 834633708], length 182
01:45:35.608396 IP f15b99ef190b.42704 > docker-compose-db-1.docker-compose_iceberg_net.5432: Flags [.], ack 539, win 2085, options [nop,nop,TS val 834633709 ecr 2113899319], length 0
01:45:35.609119 IP f15b99ef190b.8181 > 172.18.0.1.45038: Flags [P.], seq 3048:6095, ack 676, win 42, options [nop,nop,TS val 292098880 ecr 735053216], length 3047
01:45:35.609160 IP 172.18.0.1.45038 > f15b99ef190b.8181: Flags [.], ack 6095, win 41, options [nop,nop,TS val 735062786 ecr 292098880], length 0
01:45:35.609173 IP f15b99ef190b.42704 > docker-compose-db-1.docker-compose_iceberg_net.5432: Flags [P.], seq 393:398, ack 539, win 2085, options [nop,nop,TS val 834633710 ecr 2113899319], length 5
01:45:35.609192 IP docker-compose-db-1.docker-compose_iceberg_net.5432 > f15b99ef190b.42704: Flags [P.], seq 539:545, ack 398, win 1904, options [nop,nop,TS val 2113899320 ecr 834633710], length 6
01:45:35.648733 IP f15b99ef190b.42718 > docker-compose-db-1.docker-compose_iceberg_net.5432: Flags [.], ack 53389, win 20347, options [nop,nop,TS val 834633749 ecr 2113899319], length 0
01:45:35.649744 IP f15b99ef190b.42704 > docker-compose-db-1.docker-compose_iceberg_net.5432: Flags [.], ack 545, win 2085, options [nop,nop,TS val 834633750 ecr 2113899320], length 0
```

**Comment by TennyZhuang** [comment]
The belowing output is analyzed by LLM.


---

### Key Findings and Bottleneck Identification
#### 1. **HTTP Request Blocking (Core Bottleneck)**
- **Observations**:  
  - **Request Initiation**: At `01:45:26.039314`, the client sends a 338-byte HTTP request (`Flags [P.]`) to LakeKeeper (port 8181).  
  - **Final Response**: At `01:45:35.609173`, LakeKeeper returns 3047 bytes of data (`seq 3048:6095`), immediately acknowledged by the client.  
  - **Total Latency**: **9.57 seconds** (matching the code’s execution time), indicating the delay occurred during LakeKeeper’s internal processing phase.  

- **No Network Issues**:  
  - Three-way handshake shows no delays (SYN/SYN-ACK interval <1ms).  
  - No retransmissions (`retransmission` flags absent).  
  - Clean client-to-LakeKeeper traffic confirms the network is not the bottleneck.  

#### 2. **Database Interaction Segmentation**
- **Initial Fast Interactions**:  
  Starting at `01:45:26.039660`, LakeKeeper and PostgreSQL exchange small packets (11-145 bytes) with **0.1-0.3ms RTT**, indicating fast responses for simple queries.  

- **Final Large Result Set Transmission**:  
  From `01:45:35.556332`, PostgreSQL sends **multiple large packets** (2400-5296 bytes each), totaling ~**53,365 bytes**.  
  - Transmission lasts ~**50ms** (from `01:45:35.556332` to `01:45:35.607812`), but this occurs within the HTTP request’s total latency window, confirming this phase is part of LakeKeeper’s critical path waiting for database results.  

---

### Root Causes of Performance Bottlenecks
#### 1. **Database Query Execution Delay**
- **Large Result Set Generation Overhead**:  
  PostgreSQL’s final burst of data (53KB) suggests:  
  - **Complex Query Plan**: Full table scans or heavy JOIN operations due to missing indexes.  
  - **Lock Contention**: Long-running transactions holding table locks.  
  - **Cold Data Cache**: Data not loaded into memory, triggering disk I/O.  

- **Indirect Evidence**:  
  LakeKeeper returns the HTTP response **immediately** (2ms gap) after receiving the final database data, proving application-layer processing is negligible. The bottleneck lies in the database.  

#### 2. **Secondary Factor: TCP Window Pressure**
- **PostgreSQL Send Window Limitations**:  
  Repeated `win 1923` (~2KB window) forces large result sets to split into multiple packets.  
  - Low `net.ipv4.tcp_wmem` settings (if present) could worsen segmentation overhead.  
  - However, total transmission time is only 50ms, making this a minor contributor.  

---

### Optimization Recommendations
#### 1. **Database Optimization (Highest Priority)**
- **Slow Query Analysis**  
  ```bash
  # Run inside the database container
  pg_stat_statements;  -- Identify top slow queries
  EXPLAIN ANALYZE [your_query];  -- Analyze query plans
  ```
  - Focus on full table scans, missing indexes, and costly sorting/aggregation stages.  

- **Index Optimization**  
  Ensure metadata queries for `catalog.load_table` (e.g., `data.bnuswapall.1m_testdf`) have proper indexes on critical fields (e.g., table names, partition keys).  

- **Cache Pre-warming**  
  Preload frequently accessed metadata tables into memory:  
  ```sql
  CREATE EXTENSION pg_prewarm;
  SELECT pg_prewarm('metadata_table');
  ```

#### 2. **Network Layer Tuning**
- **Increase TCP Window Size**  
  Adjust kernel parameters in the database container:  
  ```bash
  sysctl -w net.ipv4.tcp_wmem="4096 16384 33554432"  # Default -> Max 32MB
  sysctl -w net.core.rmem_max=33554432
  ```
  Reduces segmentation for large result sets.  

- **Disable Transparent Huge Pages (THP)**  
  Avoid memory allocation delays:  
  ```bash
  echo never > /sys/kernel/mm/transparent_hugepage/enabled
  ```

#### 3. **Application-Layer Adjustments**
- **Query Splitting**  
  If `load_table` fetches large metadata, split it into smaller paginated requests (e.g., `LIMIT/OFFSET`).  

- **Connection Pooling**  
  Ensure LakeKeeper uses a connection pool (e.g., HikariCP) for PostgreSQL to avoid short-connection overhead.  

---

### Validation Steps
1. **Comparative Testing**  
   Re-run `load_table` while capturing:  
   - Database-side slow query logs.  
   - LakeKeeper application logs.  
   Correlate SQL execution times with tcpdump observations.  

2. **Resource Monitoring**  
   Monitor database container resources during execution:  
   ```bash
   docker stats docker-compose-db-1  # Check CPU/memory
   iostat -x 1  # Identify disk I/O bottlenecks
   ```

3. **Minimal Reproduction**  
   Execute suspected slow queries directly via `psql` to verify if their execution times match the 9.5-second delay.  

---

By prioritizing database optimizations and validating with the above steps, you can significantly reduce query latency and improve `load_table` performance.

**Comment by TennyZhuang** [comment]
Found the slow query, which cost almost the whole time (9s).

```
 total_exec_time | prop_exec_time | calls | sync_io_time |                                                                 query                                                                  
-----------------+----------------+-------+--------------+----------------------------------------------------------------------------------------------------------------------------------------
 00:00:09.718465 | ##.#%          | 1     | 00:00:00     | SELECT                                                                                                                                +
                 |                |       |              |             t."table_id",                                                                                                             +
                 |                |       |              |             t.last_sequence_number,                                                                                                   +
                 |                |       |              |             t.last_column_id,                                                                                                         +
                 |                |       |              |             t.last_updated_ms,                                                                                                        +
                 |                |       |              |             t.last_partition_id,                                                                                                      +
                 |                |       |              |             t.table_format_version as "table_format_version: DbTableFormatVersion",                                                   +
                 |                |       |              |             ti.name as "table_name",                                                                                                  +
                 |                |       |              |             ti.location as "table_location",                                                                                          +
                 |                |       |              |             namespace_name,                                                                                                           +
                 |                |       |              |             ti.namespace_id,                                                                                                          +
                 |                |       |              |             ti."metadata_location",                                                                                                   +
                 |                |       |              |             w.storage_profile as "storage_profile: Json<StorageProfile>",                                                             +
                 |                |       |              |             w."storage_secret_id",                                                                                                    +
                 |                |       |              |             ts.schema_ids,                                                                                                            +
                 |                |       |              |             tcs.schema_id as "current_schema",                                                                                        +
                 |                |       |              |             tdps.partition_spec_id as "default_partition_spec_id",                                                                    +
                 |                |       |              |             ts.schemas as "schemas: Vec<Json<Schema>>",                                                                               +
                 |                |       |              |             tsnap.snapshot_ids,                                                                                                       +
                 |                |       |              |             tsnap.parent_snapshot_ids as "snapshot_parent_snapshot_id: Vec<Option<i64>>",                                             +
                 |                |       |              |             tsnap.sequence_numbers as "snapshot_sequence_number",                                                                     +
                 |                |       |              |             tsnap.manifest_lists as "snapshot_manifest_list: Vec<String>",                                                            +
                 |                |       |              |             tsnap.timestamp as "snapshot_timestamp_ms",                                                                               +
                 |                |       |              |             tsnap.summaries as "snapshot_summary: Vec<Json<Summary>>",                                                                +
                 |                |       |              |             tsnap.schema_ids as "snapshot_schema_id: Vec<Option<i32>>",                                                               +
                 |                |       |              |             tdsort.sort_order_id as "default_sort_order_id?",                                                                         +
                 |                |       |              |             tps.partition_spec_id as "partition_spec_ids",                                                                            +
                 |                |       |              |             tps.partition_spec as "partition_specs: Vec<Json<PartitionSpec>>",                                                        +
                 |                |       |              |             tp.keys as "table_properties_keys",                                                                                       +
                 |                |       |              |             tp.values as "table_properties_values",                                                                                   +
                 |                |       |              |             tsl.snapshot_ids as "snapshot_log_ids",                                                                                   +
                 |                |       |              |             tsl.timestamps as "snapshot_log_timestamps",                                                                              +
                 |                |       |              |             tml.metadata_files as "metadata_log_files",                                                                               +
                 |                |       |              |             tml.timestamps as "metadata_log_timestamps",                                                                              +
                 |                |       |              |             tso.sort_order_ids as "sort_order_ids",                                                                                   +
                 |                |       |              |             tso.sort_orders as "sort_orders: Vec<Json<SortOrder>>",                                                                   +
                 |                |       |              |             tr.table_ref_names as "table_ref_names",                                                                                  +
                 |                |       |              |             tr.snapshot_ids as "table_ref_snapshot_ids",                                                                              +
                 |                |       |              |             tr.retentions as "table_ref_retention: Vec<Json<SnapshotRetention>>",                                                     +
                 |                |       |              |             pstat.snapshot_ids as "partition_stats_snapshot_ids",                                                                     +
                 |                |       |              |             pstat.statistics_paths as "partition_stats_statistics_paths",                                                             +
                 |                |       |              |             pstat.file_size_in_bytes_s as "partition_stats_file_size_in_bytes",                                                       +
                 |                |       |              |             tstat.snapshot_ids as "table_stats_snapshot_ids",                                                                         +
                 |                |       |              |             tstat.statistics_paths as "table_stats_statistics_paths",                                                                 +
                 |                |       |              |             tstat.file_size_in_bytes_s as "table_stats_file_size_in_bytes",                                                           +
                 |                |       |              |             tstat.file_footer_size_in_bytes_s as "table_stats_file_footer_size_in_bytes",                                             +
                 |                |       |              |             tstat.key_metadatas as "table_stats_key_metadata: Vec<Option<String>>",                                                   +
                 |                |       |              |             tstat.blob_metadatas as "table_stats_blob_metadata: Vec<Json<Vec<BlobMetadata>>>"                                         +
                 |                |       |              |         FROM "table" t                                                                                                                +
                 |                |       |              |         INNER JOIN tabular ti ON t.table_id = ti.tabular_id                                                                           +
                 |                |       |              |         INNER JOIN namespace n ON ti.namespace_id = n.namespace_id                                                                    +
                 |                |       |              |         INNER JOIN warehouse w ON n.warehouse_id = w.warehouse_id                                                                     +
                 |                |       |              |         INNER JOIN table_current_schema tcs ON tcs.table_id = t.table_id                                                              +
                 |                |       |              |         LEFT JOIN table_default_partition_spec tdps ON tdps.table_id = t.table_id                                                     +
                 |                |       |              |         LEFT JOIN table_default_sort_order tdsort ON tdsort.table_id = t.table_id                                                     +
                 |                |       |              |         LEFT JOIN (SELECT table_id,                                                                                                   +
                 |                |       |              |                           ARRAY_AGG(schema_id) as schema_ids,                                                                         +
                 |                |       |              |                           ARRAY_AGG(schema) as schemas                                                                                +
                 |                |       |              |                    FROM table_schema                                                                                                  +
                 |                |       |              |                    GROUP BY table_id) ts ON ts.table_id = t.table_id                                                                  +
                 |                |       |              |         LEFT JOIN (SELECT table_id,                                                                                                   +
                 |                |       |              |                           ARRAY_AGG(partition_spec) as partition_spec,                                                                +
                 |                |       |              |                           ARRAY_AGG(partition_spec_id) as partition_spec_id                                                           +
                 |                |       |              |                    FROM table_partition_spec                                                                                          +
                 |                |       |              |                    GROUP BY table_id) tps ON tps.table_id = t.table_id                                                                +
                 |                |       |              |         LEFT JOIN (SELECT table_id,                                                                                                   +
                 |                |       |              |                             ARRAY_AGG(key) as keys,                                                                                   +
                 |                |       |              |                             ARRAY_AGG(value) as values                                                                                +
                 |                |       |              |                      FROM table_properties                                                                                            +
                 |                |       |              |                      GROUP BY table_id) tp ON tp.table_id = t.table_id                                                                +
                 |                |       |              |         LEFT JOIN (SELECT table_id,                                                                                                   +
                 |                |       |              |                           ARRAY_AGG(snapshot_id) as snapshot_ids,                                                                     +
                 |                |       |              |                           ARRAY_AGG(parent_snapshot_id) as parent_snapshot_ids,                                                       +
                 |                |       |              |                           ARRAY_AGG(sequence_number) as sequence_numbers,                                                             +
                 |                |       |              |                           ARRAY_AGG(manifest_list) as manifest_lists,                                                                 +
                 |                |       |              |                           ARRAY_AGG(summary) as summaries,                                                                            +
                 |                |       |              |                           ARRAY_AGG(schema_id) as schema_ids,                                                                         +
                 |                |       |              |                           ARRAY_AGG(timestamp_ms) as timestamp                                                                        +
                 |                |       |              |                    FROM table_snapshot                                                                                                +
                 |                |       |              |                    GROUP BY table_id) tsnap ON tsnap.table_id = t.table_id                                                            +
                 |                |       |              |         LEFT JOIN (SELECT table_id,                                                                                                   +
                 |                |       |              |                           ARRAY_AGG(snapshot_id ORDER BY sequence_number) as snapshot_ids,                                            +
                 |                |       |              |                           ARRAY_AGG(timestamp ORDER BY sequence_number) as timestamps                                                 +
                 |                |       |              |                      FROM table_snapshot_log                                                                                          +
                 |                |       |              |                      GROUP BY table_id) tsl ON tsl.table_id = t.table_id                                                              +
                 |                |       |              |         LEFT JOIN (SELECT table_id,                                                                                                   +
                 |                |       |              |                           ARRAY_AGG(timestamp ORDER BY sequence_number) as timestamps,                                                +
                 |                |       |              |                           ARRAY_AGG(metadata_file ORDER BY sequence_number) as metadata_files                                         +
                 |                |       |              |                    FROM table_metadata_log                                                                                            +
                 |                |       |              |                    GROUP BY table_id) tml ON tml.table_id = t.table_id                                                                +
                 |                |       |              |         LEFT JOIN (SELECT table_id,                                                                                                   +
                 |                |       |              |                           ARRAY_AGG(sort_order_id) as sort_order_ids,                                                                 +
                 |                |       |              |                           ARRAY_AGG(sort_order) as sort_orders                                                                        +
                 |                |       |              |                      FROM table_sort_order                                                                                            +
                 |                |       |              |                         GROUP BY table_id) tso ON tso.table_id = t.table_id                                                           +
                 |                |       |              |         LEFT JOIN (SELECT table_id,                                                                                                   +
                 |                |       |              |                           ARRAY_AGG(table_ref_name) as table_ref_names,                                                               +
                 |                |       |              |                           ARRAY_AGG(snapshot_id) as snapshot_ids,                                                                     +
                 |                |       |              |                           ARRAY_AGG(retention) as retentions                                                                          +
                 |                |       |              |                    FROM table_refs                                                                                                    +
                 |                |       |              |                    GROUP BY table_id) tr ON tr.table_id = t.table_id                                                                  +
                 |                |       |              |         LEFT JOIN (SELECT table_id,                                                                                                   +
                 |                |       |              |                           ARRAY_AGG(snapshot_id) as snapshot_ids,                                                                     +
                 |                |       |              |                           ARRAY_AGG(statistics_path) as statistics_paths,                                                             +
                 |                |       |              |                           ARRAY_AGG(file_size_in_bytes) as file_size_in_bytes_s                                                       +
                 |                |       |              |                     FROM partition_statistics                                                                                         +
                 |                |       |              |                     GROUP BY table_id) pstat ON pstat.table_id = t.table_id                                                           +
                 |                |       |              |         LEFT JOIN (SELECT table_id,                                                                                                   +
                 |                |       |              |                           ARRAY_AGG(snapshot_id) as snapshot_ids,                                                                     +
                 |                |       |              |                           ARRAY_AGG(statistics_path) as statistics_paths,                                                             +
                 |                |       |              |                           ARRAY_AGG(file_size_in_bytes) as file_size_in_bytes_s,                                                      +
                 |                |       |              |                           ARRAY_AGG(file_footer_size_in_bytes) as file_footer_size_in_bytes_s,                                        +
                 |                |       |              |                           ARRAY_AGG(key_metadata) as key_metadatas,                                                                   +
                 |                |       |              |                           ARRAY_AGG(blob_metadata) as blob_metadatas                                                                  +
                 |                |       |              |                     FROM table_statistics                                                                                             +
                 |                |       |              |                     GROUP BY table_id) tstat ON tstat.table_id = t.table_id                                                           +
                 |                |       |              |         WHERE w.warehouse_id = $1                                                                                                     +
                 |                |       |              |             AND w.status = $4                                                                                                         +
                 |                |       |              |             AND (ti.deleted_at IS NULL OR $3)                                                                                         +
                 |                |       |              |             AND t."table_id" = ANY($2)
```

**Comment by TennyZhuang** [comment]
And the raw slow query extracted by LLM:

```
SELECT
    t."table_id",
    t.last_sequence_number,
    t.last_column_id,
    t.last_updated_ms,
    t.last_partition_id,
    t.table_format_version as "table_format_version: DbTableFormatVersion",
    ti.name as "table_name",
    ti.location as "table_location",
    namespace_name,
    ti.namespace_id,
    ti."metadata_location",
    w.storage_profile as "storage_profile: Json<StorageProfile>",
    w."storage_secret_id",
    ts.schema_ids,
    tcs.schema_id as "current_schema",
    tdps.partition_spec_id as "default_partition_spec_id",
    ts.schemas as "schemas: Vec<Json<Schema>>",
    tsnap.snapshot_ids,
    tsnap.parent_snapshot_ids as "snapshot_parent_snapshot_id: Vec<Option<i64>>",
    tsnap.sequence_numbers as "snapshot_sequence_number",
    tsnap.manifest_lists as "snapshot_manifest_list: Vec<String>",
    tsnap.timestamp as "snapshot_timestamp_ms",
    tsnap.summaries as "snapshot_summary: Vec<Json<Summary>>",
    tsnap.schema_ids as "snapshot_schema_id: Vec<Option<i32>>",
    tdsort.sort_order_id as "default_sort_order_id?",
    tps.partition_spec_id as "partition_spec_ids",
    tps.partition_spec as "partition_specs: Vec<Json<PartitionSpec>>",
    tp.keys as "table_properties_keys",
    tp.values as "table_properties_values",
    tsl.snapshot_ids as "snapshot_log_ids",
    tsl.timestamps as "snapshot_log_timestamps",
    tml.metadata_files as "metadata_log_files",
    tml.timestamps as "metadata_log_timestamps",
    tso.sort_order_ids as "sort_order_ids",
    tso.sort_orders as "sort_orders: Vec<Json<SortOrder>>",
    tr.table_ref_names as "table_ref_names",
    tr.snapshot_ids as "table_ref_snapshot_ids",
    tr.retentions as "table_ref_retention: Vec<Json<SnapshotRetention>>",
    pstat.snapshot_ids as "partition_stats_snapshot_ids",
    pstat.statistics_paths as "partition_stats_statistics_paths",
    pstat.file_size_in_bytes_s as "partition_stats_file_size_in_bytes",
    tstat.snapshot_ids as "table_stats_snapshot_ids",
    tstat.statistics_paths as "table_stats_statistics_paths",
    tstat.file_size_in_bytes_s as "table_stats_file_size_in_bytes",
    tstat.file_footer_size_in_bytes_s as "table_stats_file_footer_size_in_bytes",
    tstat.key_metadatas as "table_stats_key_metadata: Vec<Option<String>>",
    tstat.blob_metadatas as "table_stats_blob_metadata: Vec<Json<Vec<BlobMetadata>>>"
FROM "table" t
INNER JOIN tabular ti ON t.table_id = ti.tabular_id
INNER JOIN namespace n ON ti.namespace_id = n.namespace_id
INNER JOIN warehouse w ON n.warehouse_id = w.warehouse_id
INNER JOIN table_current_schema tcs ON tcs.table_id = t.table_id
LEFT JOIN table_default_partition_spec tdps ON tdps.table_id = t.table_id
LEFT JOIN table_default_sort_order tdsort ON tdsort.table_id = t.table_id
LEFT JOIN (
    SELECT table_id,
           ARRAY_AGG(schema_id) as schema_ids,
           ARRAY_AGG(schema) as schemas
    FROM table_schema
    GROUP BY table_id
) ts ON ts.table_id = t.table_id
LEFT JOIN (
    SELECT table_id,
           ARRAY_AGG(partition_spec) as partition_spec,
           ARRAY_AGG(partition_spec_id) as partition_spec_id
    FROM table_partition_spec
    GROUP BY table_id
) tps ON tps.table_id = t.table_id
LEFT JOIN (
    SELECT table_id,
           ARRAY_AGG(key) as keys,
           ARRAY_AGG(value) as values
    FROM table_properties
    GROUP BY table_id
) tp ON tp.table_id = t.table_id
LEFT JOIN (
    SELECT table_id,
           ARRAY_AGG(snapshot_id) as snapshot_ids,
           ARRAY_AGG(parent_snapshot_id) as parent_snapshot_ids,
           ARRAY_AGG(sequence_number) as sequence_numbers,
           ARRAY_AGG(manifest_list) as manifest_lists,
           ARRAY_AGG(summary) as summaries,
           ARRAY_AGG(schema_id) as schema_ids,
           ARRAY_AGG(timestamp_ms) as timestamp
    FROM table_snapshot
    GROUP BY table_id
) tsnap ON tsnap.table_id = t.table_id
LEFT JOIN (
    SELECT table_id,
           ARRAY_AGG(snapshot_id ORDER BY sequence_number) as snapshot_ids,
           ARRAY_AGG(timestamp ORDER BY sequence_number) as timestamps
    FROM table_snapshot_log
    GROUP BY table_id
) tsl ON tsl.table_id = t.table_id
LEFT JOIN (
    SELECT table_id,
           ARRAY_AGG(timestamp ORDER BY sequence_number) as timestamps,
           ARRAY_AGG(metadata_file ORDER BY sequence_number) as metadata_files
    FROM table_metadata_log
    GROUP BY table_id
) tml ON tml.table_id = t.table_id
LEFT JOIN (
    SELECT table_id,
           ARRAY_AGG(sort_order_id) as sort_order_ids,
           ARRAY_AGG(sort_order) as sort_orders
    FROM table_sort_order
    GROUP BY table_id
) tso ON tso.table_id = t.table_id
LEFT JOIN (
    SELECT table_id,
           ARRAY_AGG(table_ref_name) as table_ref_names,
           ARRAY_AGG(snapshot_id) as snapshot_ids,
           ARRAY_AGG(retention) as retentions
    FROM table_refs
    GROUP BY table_id
) tr ON tr.table_id = t.table_id
LEFT JOIN (
    SELECT table_id,
           ARRAY_AGG(snapshot_id) as snapshot_ids,
           ARRAY_AGG(statistics_path) as statistics_paths,
           ARRAY_AGG(file_size_in_bytes) as file_size_in_bytes_s
    FROM partition_statistics
    GROUP BY table_id
) pstat ON pstat.table_id = t.table_id
LEFT JOIN (
    SELECT table_id,
           ARRAY_AGG(snapshot_id) as snapshot_ids,
           ARRAY_AGG(statistics_path) as statistics_paths,
           ARRAY_AGG(file_size_in_bytes) as file_size_in_bytes_s,
           ARRAY_AGG(file_footer_size_in_bytes) as file_footer_size_in_bytes_s,
           ARRAY_AGG(key_metadata) as key_metadatas,
           ARRAY_AGG(blob_metadata) as blob_metadatas
    FROM table_statistics
    GROUP BY table_id
) tstat ON tstat.table_id = t.table_id
WHERE w.warehouse_id = $1
  AND w.status = $4
  AND (ti.deleted_at IS NULL OR $3)
  AND t."table_id" = ANY($2)
```

**Comment by TennyZhuang** [comment]
```
postgres=# select count(1) from table_snapshot;
  count  
---------
 2829565
(1 row)
```

Do you guys consider a warehouse may contain a huge number of snapshots? It's very common.

**Comment by TennyZhuang** [comment]
The SQL and explain result:

```
postgres=# EXPLAIN              SELECT
                    t."table_id",
                    t.last_sequence_number,
                    t.last_column_id,
                    t.last_updated_ms,
                    t.last_partition_id,
                    t.table_format_version as "table_format_version: DbTableFormatVersion",
                    ti.name as "table_name",
                    ti.location as "table_location",
                    namespace_name,
                    ti.namespace_id,
                    ti."metadata_location",
                    w.storage_profile as "storage_profile: Json<StorageProfile>",
                    w."storage_secret_id",
                    ts.schema_ids,
                    tcs.schema_id as "current_schema",
                    tdps.partition_spec_id as "default_partition_spec_id",
                    ts.schemas as "schemas: Vec<Json<Schema>>",
                    tsnap.snapshot_ids,
                    tsnap.parent_snapshot_ids as "snapshot_parent_snapshot_id: Vec<Option<i64>>",
                    tsnap.sequence_numbers as "snapshot_sequence_number",
                    tsnap.manifest_lists as "snapshot_manifest_list: Vec<String>",
                    tsnap.timestamp as "snapshot_timestamp_ms",
                    tsnap.summaries as "snapshot_summary: Vec<Json<Summary>>",
                    tsnap.schema_ids as "snapshot_schema_id: Vec<Option<i32>>",
                    tdsort.sort_order_id as "default_sort_order_id?",
                    tps.partition_spec_id as "partition_spec_ids",
                    tps.partition_spec as "partition_specs: Vec<Json<PartitionSpec>>",
                    tp.keys as "table_properties_keys",
                    tp.values as "table_properties_values",
                    tsl.snapshot_ids as "snapshot_log_ids",
                    tsl.timestamps as "snapshot_log_timestamps",
                    tml.metadata_files as "metadata_log_files",
                    tml.timestamps as "metadata_log_timestamps",
                    tso.sort_order_ids as "sort_order_ids",
                    tso.sort_orders as "sort_orders: Vec<Json<SortOrder>>",
                    tr.table_ref_names as "table_ref_names",
                    tr.snapshot_ids as "table_ref_snapshot_ids",
                    tr.retentions as "table_ref_retention: Vec<Json<SnapshotRetention>>",
                    pstat.snapshot_ids as "partition_stats_snapshot_ids",
                    pstat.statistics_paths as "partition_stats_statistics_paths",
                    pstat.file_size_in_bytes_s as "partition_stats_file_size_in_bytes",
                    tstat.snapshot_ids as "table_stats_snapshot_ids",
                    tstat.statistics_paths as "table_stats_statistics_paths",
                    tstat.file_size_in_bytes_s as "table_stats_file_size_in_bytes",
                    tstat.file_footer_size_in_bytes_s as "table_stats_file_footer_size_in_bytes",
                    tstat.key_metadatas as "table_stats_key_metadata: Vec<Option<String>>",
                    tstat.blob_metadatas as "table_stats_blob_metadata: Vec<Json<Vec<BlobMetadata>>>"
                FROM "table" t
                    AND t."table_id" = ANY('{7d6c9a3f-0d32-4f3f-8a34-364f90724f7b}');_size_in_bytes_s,
                                                                                             QUERY PLAN                                                                             
                
------------------------------------------------------------------------------------------------------------------------------------------------------------------------------------
----------------
 Merge Left Join  (cost=873702.00..1190106.67 rows=1 width=1367)
   Merge Cond: (t.table_id = table_statistics.table_id)
   ->  Nested Loop Left Join  (cost=873667.67..1190055.83 rows=1 width=1175)
         Join Filter: (partition_statistics.table_id = t.table_id)
         ->  Merge Left Join  (cost=873642.67..1190022.83 rows=1 width=1079)
               Merge Cond: (t.table_id = table_refs.table_id)
               ->  Merge Left Join  (cost=873642.39..1188882.23 rows=1 width=983)
                     Merge Cond: (t.table_id = table_sort_order.table_id)
                     ->  Merge Left Join  (cost=872737.60..1187647.31 rows=1 width=919)
                           Merge Cond: (t.table_id = table_metadata_log.table_id)
                           ->  Merge Left Join  (cost=872737.18..1161294.44 rows=1 width=855)
                                 Merge Cond: (t.table_id = table_snapshot_log.table_id)
                                 ->  Merge Left Join  (cost=872736.75..914785.66 rows=1 width=791)
                                       Merge Cond: (t.table_id = table_snapshot.table_id)
                                       ->  Merge Left Join  (cost=988.99..15081.10 rows=1 width=567)
                                             Merge Cond: (t.table_id = table_properties.table_id)
                                             ->  Merge Left Join  (cost=902.75..14951.57 rows=1 width=503)
                                                   Merge Cond: (t.table_id = table_partition_spec.table_id)
                                                   ->  Merge Left Join  (cost=2.14..13720.01 rows=1 width=439)
                                                         Merge Cond: (t.table_id = table_schema.table_id)
                                                         ->  Nested Loop Left Join  (cost=1.72..41.95 rows=1 width=375)
                                                               ->  Nested Loop Left Join  (cost=1.44..33.64 rows=1 width=367)
                                                                     ->  Nested Loop  (cost=1.15..25.34 rows=1 width=363)
                                                                           Join Filter: (t.table_id = tcs.table_id)
                                                                           ->  Nested Loop  (cost=0.87..24.97 rows=1 width=375)
                                                                                 ->  Nested Loop  (cost=0.72..16.79 rows=1 width=343)
                                                                                       ->  Nested Loop  (cost=0.57..16.61 rows=1 width=295)
                                                                                             ->  Index Scan using table_pkey on "table" t  (cost=0.29..8.30 rows=1 width=44)
                                                                                                   Index Cond: (table_id = ANY ('{7d6c9a3f-0d32-4f3f-8a34-364f90724f7b}'::uuid[]))
                                                                                             ->  Index Scan using tabular_pkey on tabular ti  (cost=0.29..8.30 rows=1 width=251)
                                                                                                   Index Cond: (tabular_id = t.table_id)
                                                                                                   Filter: (deleted_at IS NULL)
                                                                                       ->  Index Scan using namespace_pkey on namespace n  (cost=0.15..0.18 rows=1 width=64)
                                                                                             Index Cond: (namespace_id = ti.namespace_id)
                                                                                             Filter: (warehouse_id = '772a7b48-d95c-11ef-961b-fb4fa81289ca'::uuid)
                                                                                 ->  Index Scan using warehouse_pkey on warehouse w  (cost=0.15..8.17 rows=1 width=64)
                                                                                       Index Cond: (warehouse_id = '772a7b48-d95c-11ef-961b-fb4fa81289ca'::uuid)
                                                                                       Filter: (status = 'active'::warehouse_status)
                                                                           ->  Index Scan using table_current_schema_pkey on table_current_schema tcs  (cost=0.29..0.35 rows=1 width
=20)
                                                                                 Index Cond: (table_id = ti.tabular_id)
                                                                     ->  Index Scan using table_default_partition_spec_pkey on table_default_partition_spec tdps  (cost=0.29..8.30 r
ows=1 width=20)
                                                                           Index Cond: (table_id = t.table_id)
                                                               ->  Index Scan using table_default_sort_order_pkey on table_default_sort_order tdsort  (cost=0.29..8.30 rows=1 width=
24)
                                                                     Index Cond: (table_id = t.table_id)
                                                         ->  GroupAggregate  (cost=0.42..13605.30 rows=5820 width=80)
                                                               Group Key: table_schema.table_id
                                                               ->  Index Scan using table_schema_pkey on table_schema  (cost=0.42..12636.81 rows=117492 width=95)
                                                   ->  GroupAggregate  (cost=900.61..1121.24 rows=8825 width=80)
                                                         Group Key: table_partition_spec.table_id
                                                         ->  Sort  (cost=900.61..922.68 rows=8825 width=174)
                                                               Sort Key: table_partition_spec.table_id
                                                               ->  Seq Scan on table_partition_spec  (cost=0.00..322.25 rows=8825 width=174)
                                             ->  GroupAggregate  (cost=86.23..115.08 rows=1154 width=80)
                                                   Group Key: table_properties.table_id
                                                   ->  Sort  (cost=86.23..89.12 rows=1154 width=53)
                                                         Sort Key: table_properties.table_id
                                                         ->  Seq Scan on table_properties  (cost=0.00..27.54 rows=1154 width=53)
                                       ->  Finalize GroupAggregate  (cost=871747.76..899656.68 rows=3830 width=240)
                                             Group Key: table_snapshot.table_id
                                             ->  Gather Merge  (cost=871747.76..899264.11 rows=7660 width=240)
                                                   Workers Planned: 2
                                                   ->  Partial GroupAggregate  (cost=870747.73..897379.93 rows=3830 width=240)
                                                         Group Key: table_snapshot.table_id
                                                         ->  Sort  (cost=870747.73..873695.16 rows=1178972 width=505)
                                                               Sort Key: table_snapshot.table_id
                                                               ->  Parallel Seq Scan on table_snapshot  (cost=0.00..211873.73 rows=1178972 width=505)
                                 ->  GroupAggregate  (cost=0.43..246458.69 rows=4006 width=80)
                                       Group Key: table_snapshot_log.table_id
                                       ->  Index Scan using table_snapshot_log_pkey on table_snapshot_log  (cost=0.43..226733.49 rows=2622015 width=40)
                           ->  GroupAggregate  (cost=0.42..26309.15 rows=3496 width=80)
                                 Group Key: table_metadata_log.table_id
                                 ->  Index Scan using table_metadata_log_pkey on table_metadata_log  (cost=0.42..24918.52 rows=178426 width=156)
                     ->  GroupAggregate  (cost=904.79..1124.87 rows=8803 width=80)
                           Group Key: table_sort_order.table_id
                           ->  Sort  (cost=904.79..926.80 rows=8803 width=184)
                                 Sort Key: table_sort_order.table_id
                                 ->  Seq Scan on table_sort_order  (cost=0.00..328.03 rows=8803 width=184)
               ->  GroupAggregate  (cost=0.29..1030.48 rows=8809 width=112)
                     Group Key: table_refs.table_id
                     ->  Index Scan using table_refs_pkey on table_refs  (cost=0.29..788.23 rows=8809 width=52)
         ->  HashAggregate  (cost=25.00..28.50 rows=200 width=112)
               Group Key: partition_statistics.table_id
               ->  Seq Scan on partition_statistics  (cost=0.00..17.50 rows=750 width=64)
   ->  GroupAggregate  (cost=34.33..48.33 rows=200 width=208)
         Group Key: table_statistics.table_id
         ->  Sort  (cost=34.33..35.46 rows=450 width=136)
               Sort Key: table_statistics.table_id
               ->  Seq Scan on table_statistics  (cost=0.00..14.50 rows=450 width=136)
(88 rows)
```

**Comment by TennyZhuang** [comment]
After some trivial optimization on the SQL, the final result:

Time: 3.871 ms

As an experienced database kernel developer, my personal experience is not to rely too much on the database optimizer in complex queries.

The optimized query, push down the filter `table_id` to every subquery manually.

```sql
	        SELECT
	            t."table_id",
	            t.last_sequence_number,
	            t.last_column_id,
	            t.last_updated_ms,
	            t.last_partition_id,
	            t.table_format_version as "table_format_version: DbTableFormatVersion",
	            ti.name as "table_name",
	            ti.location as "table_location",
	            namespace_name,
	            ti.namespace_id,
	            ti."metadata_location",
	            w.storage_profile as "storage_profile: Json<StorageProfile>",
	            w."storage_secret_id",
	            ts.schema_ids,
	            tcs.schema_id as "current_schema",
	            tdps.partition_spec_id as "default_partition_spec_id",
	            ts.schemas as "schemas: Vec<Json<Schema>>",
	            tsnap.snapshot_ids,
	            tsnap.parent_snapshot_ids as "snapshot_parent_snapshot_id: Vec<Option<i64>>",
	            tsnap.sequence_numbers as "snapshot_sequence_number",
	            tsnap.manifest_lists as "snapshot_manifest_list: Vec<String>",
	            tsnap.timestamp as "snapshot_timestamp_ms",
	            tsnap.summaries as "snapshot_summary: Vec<Json<Summary>>",
	            tsnap.schema_ids as "snapshot_schema_id: Vec<Option<i32>>",
	            tdsort.sort_order_id as "default_sort_order_id?",
	            tps.partition_spec_id as "partition_spec_ids",
	            tps.partition_spec as "partition_specs: Vec<Json<PartitionSpec>>",
	            tp.keys as "table_properties_keys",
	            tp.values as "table_properties_values",
	            tsl.snapshot_ids as "snapshot_log_ids",
	            tsl.timestamps as "snapshot_log_timestamps",
	            tml.metadata_files as "metadata_log_files",
	            tml.timestamps as "metadata_log_timestamps",
	            tso.sort_order_ids as "sort_order_ids",
	            tso.sort_orders as "sort_orders: Vec<Json<SortOrder>>",
	            tr.table_ref_names as "table_ref_names",
	            tr.snapshot_ids as "table_ref_snapshot_ids",
	            tr.retentions as "table_ref_retention: Vec<Json<SnapshotRetention>>",
	            pstat.snapshot_ids as "partition_stats_snapshot_ids",
	            pstat.statistics_paths as "partition_stats_statistics_paths",
	            pstat.file_size_in_bytes_s as "partition_stats_file_size_in_bytes",
	            tstat.snapshot_ids as "table_stats_snapshot_ids",
	            tstat.statistics_paths as "table_stats_statistics_paths",
	            tstat.file_size_in_bytes_s as "table_stats_file_size_in_bytes",
	            tstat.file_footer_size_in_bytes_s as "table_stats_file_footer_size_in_bytes",
	            tstat.key_metadatas as "table_stats_key_metadata: Vec<Option<String>>",
	            tstat.blob_metadatas as "table_stats_blob_metadata: Vec<Json<Vec<BlobMetadata>>>"
	        FROM "table" t
	        INNER JOIN tabular ti ON t.table_id = ti.tabular_id
	        INNER JOIN namespace n ON ti.namespace_id = n.namespace_id
	        INNER JOIN warehouse w ON n.warehouse_id = w.warehouse_id
	        INNER JOIN table_current_schema tcs ON tcs.table_id = t.table_id
	        LEFT JOIN table_default_partition_spec tdps ON tdps.table_id = t.table_id
	        LEFT JOIN table_default_sort_order tdsort ON tdsort.table_id = t.table_id
	        LEFT JOIN (SELECT table_id,
	                          ARRAY_AGG(schema_id) as schema_ids,
	                          ARRAY_AGG(schema) as schemas
	                   FROM table_schema WHERE table_id = '7d6c9a3f-0d32-4f3f-8a34-364f90724f7b' GROUP BY table_id) ts ON ts.table_id = t.table_id
	        LEFT JOIN (SELECT table_id,
	                          ARRAY_AGG(partition_spec) as partition_spec,
	                          ARRAY_AGG(partition_spec_id) as partition_spec_id
	                   FROM table_partition_spec WHERE table_id = '7d6c9a3f-0d32-4f3f-8a34-364f90724f7b' GROUP BY table_id) tps ON tps.table_id = t.table_id
	                   ) tps ON tps.table_id = t.table_id
	        LEFT JOIN (SELECT table_id,
	                            ARRAY_AGG(key) as keys,
	                            ARRAY_AGG(value) as values
	                     FROM table_properties WHERE table_id = '7d6c9a3f-0d32-4f3f-8a34-364f90724f7b' GROUP BY table_id) tp ON tp.table_id = t.table_id
	        LEFT JOIN (SELECT table_id,
	                          ARRAY_AGG(snapshot_id) as snapshot_ids,
	                          ARRAY_AGG(parent_snapshot_id) as parent_snapshot_ids,
	                          ARRAY_AGG(sequence_number) as sequence_numbers,
	                          ARRAY_AGG(manifest_list) as manifest_lists,
	                          ARRAY_AGG(summary) as summaries,
	                          ARRAY_AGG(schema_id) as schema_ids,
	                          ARRAY_AGG(timestamp_ms) as timestamp
	                   FROM table_snapshot WHERE table_id = '7d6c9a3f-0d32-4f3f-8a34-364f90724f7b' GROUP BY table_id) tsnap ON tsnap.table_id = t.table_id
	        LEFT JOIN (SELECT table_id,
	                          ARRAY_AGG(snapshot_id ORDER BY sequence_number) as snapshot_ids,
	                          ARRAY_AGG(timestamp ORDER BY sequence_number) as timestamps
	                     FROM table_snapshot_log WHERE table_id = '7d6c9a3f-0d32-4f3f-8a34-364f90724f7b' GROUP BY table_id) tsl ON tsl.table_id = t.table_id
	        LEFT JOIN (SELECT table_id,
	                          ARRAY_AGG(timestamp ORDER BY sequence_number) as timestamps,
	                          ARRAY_AGG(metadata_file ORDER BY sequence_number) as metadata_files
	                   FROM table_metadata_log WHERE table_id = '7d6c9a3f-0d32-4f3f-8a34-364f90724f7b' GROUP BY table_id) tml ON tml.table_id = t.table_id
	        LEFT JOIN (SELECT table_id,
	                          ARRAY_AGG(sort_order_id) as sort_order_ids,
	                          ARRAY_AGG(sort_order) as sort_orders
	                     FROM table_sort_order WHERE table_id = '7d6c9a3f-0d32-4f3f-8a34-364f90724f7b' GROUP BY table_id) tso ON tso.table_id = t.table_id
	        LEFT JOIN (SELECT table_id,
	                          ARRAY_AGG(table_ref_name) as table_ref_names,
	                          ARRAY_AGG(snapshot_id) as snapshot_ids,
	                          ARRAY_AGG(retention) as retentions
	                   FROM table_refs WHERE table_id = '7d6c9a3f-0d32-4f3f-8a34-364f90724f7b' GROUP BY table_id) tr ON tr.table_id = t.table_id
	        LEFT JOIN (SELECT table_id,
	                          ARRAY_AGG(snapshot_id) as snapshot_ids,
	                          ARRAY_AGG(statistics_path) as statistics_paths,
	                          ARRAY_AGG(file_size_in_bytes) as file_size_in_bytes_s
	                    FROM partition_statistics WHERE table_id = '7d6c9a3f-0d32-4f3f-8a34-364f90724f7b' GROUP BY table_id) pstat ON pstat.table_id = t.table_id
	        LEFT JOIN (SELECT table_id,
	                          ARRAY_AGG(snapshot_id) as snapshot_ids,
	                          ARRAY_AGG(statistics_path) as statistics_paths,
	                          ARRAY_AGG(file_size_in_bytes) as file_size_in_bytes_s,
	                          ARRAY_AGG(file_footer_size_in_bytes) as file_footer_size_in_bytes_s,
	                          ARRAY_AGG(key_metadata) as key_metadatas,
	                          ARRAY_AGG(blob_metadata) as blob_metadatas
	                    FROM table_statistics WHERE table_id = '7d6c9a3f-0d32-4f3f-8a34-364f90724f7b' GROUP BY table_id) tstat ON tstat.table_id = t.table_id
	        WHERE w.warehouse_id = '772a7b48-d95c-11ef-961b-fb4fa81289ca'
	            AND w.status = 'active'
	            AND (ti.deleted_at IS NULL OR 'f')
	            AND t."table_id" = ANY('{7d6c9a3f-0d32-4f3f-8a34-364f90724f7b}')
```


I'd like to submit the patch as a PR if the solution is acceptable.

**Comment by twuebi** [comment]
thanks for taking a look at this, we didn't test with such orders of magnitude yet, we'd be happy to accept a PR!
